### ISSUE TITLE
[Bug] 隧道防护 > 隧道管理处添加的MCBE服务器无法使用

### ISSUE THREAD

**Issue by minc-nice-100** [samwafgo/SamWaf#414]
### 产品版本

20250718(v1.3.16-beta.6)

### 版本类型

- [x] 社区版

### 环境信息

Ubuntu Server TLS 24
Docker Compose
Network mode: host

### 🐛 缺陷描述

<img width="721" height="777" alt="Image" src="https://github.com/user-attachments/assets/dcb7883e-c788-4b01-9240-9b5c14907687" />

10484 是本地的 MC 服务器暴露的端口, 19132 是暴露给公网以及转发服务器的端口.

### 期望结果

解决这个问题

### 补充信息

以下是对 bond0 port 19132 的抓包, ipv6 的是我的连接流量
```text
root@server:~# tcpdump -n udp port 19132 -i bond0
tcpdump: verbose output suppressed, use -v[v]... for full protocol decode
listening on bond0, link-type EN10MB (Ethernet), snapshot length 262144 bytes
16:51:39.787205 IP 10.85.142.251.40333 > 10.127.255.255.19132: UDP, length 33
16:51:40.807443 IP 10.85.142.251.40333 > 10.127.255.255.19132: UDP, length 33
16:51:41.801825 IP 10.85.142.251.40333 > 10.127.255.255.19132: UDP, length 33
16:51:42.840534 IP 10.85.142.251.40333 > 10.127.255.255.19132: UDP, length 33
16:51:45.671006 IP 10.85.142.251.40333 > 10.127.255.255.19132: UDP, length 33
16:51:46.689533 IP 10.85.142.251.40333 > 10.127.255.255.19132: UDP, length 33
16:51:47.705390 IP 10.85.142.251.40333 > 10.127.255.255.19132: UDP, length 33
16:51:48.713338 IP 10.85.142.251.40333 > 10.127.255.255.19132: UDP, length 33
16:51:49.302036 IP6 240e:3b1:5a22:5e70:fbb2:6198:1d98:5ddb.45434 > 240e:3b1:5a22:5e70:5c05:54ff:fe6b:a599.19132: UDP, length 33
16:51:49.730737 IP 10.85.142.251.40333 > 10.127.255.255.19132: UDP, length 33
16:51:50.745663 IP 10.85.142.251.40333 > 10.127.255.255.19132: UDP, length 33
16:51:51.761368 IP 10.85.142.251.40333 > 10.127.255.255.19132: UDP, length 33
16:51:52.785575 IP 10.85.142.251.40333 > 10.127.255.255.19132: UDP, length 33
16:51:53.800253 IP 10.85.142.251.40333 > 10.127.255.255.19132: UDP, length 33
16:51:54.795360 IP 10.85.142.251.40333 > 10.127.255.255.19132: UDP, length 33
16:51:55.821082 IP 10.85.142.251.40333 > 10.127.255.255.19132: UDP, length 33
16:51:56.826050 IP 10.85.142.251.40333 > 10.127.255.255.19132: UDP, length 33
16:51:57.850068 IP 10.85.142.251.40333 > 10.127.255.255.19132: UDP, length 33
16:51:58.856310 IP 10.85.142.251.40333 > 10.127.255.255.19132: UDP, length 33
16:51:59.873754 IP 10.85.142.251.40333 > 10.127.255.255.19132: UDP, length 33
16:52:00.874741 IP 10.85.142.251.40333 > 10.127.255.255.19132: UDP, length 33
16:52:01.892377 IP 10.85.142.251.40333 > 10.127.255.255.19132: UDP, length 33
16:52:02.830321 IP6 240e:3b1:5a22:5e70:fbb2:6198:1d98:5ddb.37506 > 240e:3b1:5a22:5e70:5c05:54ff:fe6b:a599.19132: UDP, length 1172
16:52:02.889126 IP 10.85.142.251.40333 > 10.127.255.255.19132: UDP, length 33
16:52:03.331905 IP6 240e:3b1:5a22:5e70:fbb2:6198:1d98:5ddb.37506 > 240e:3b1:5a22:5e70:5c05:54ff:fe6b:a599.19132: UDP, length 1172
16:52:03.852820 IP6 240e:3b1:5a22:5e70:fbb2:6198:1d98:5ddb.37506 > 240e:3b1:5a22:5e70:5c05:54ff:fe6b:a599.19132: UDP, length 1172
16:52:03.905506 IP 10.85.142.251.40333 > 10.127.255.255.19132: UDP, length 33
16:52:04.360692 IP6 240e:3b1:5a22:5e70:fbb2:6198:1d98:5ddb.37506 > 240e:3b1:5a22:5e70:5c05:54ff:fe6b:a599.19132: UDP, length 1172
16:52:04.850571 IP6 240e:3b1:5a22:5e70:fbb2:6198:1d98:5ddb.37506 > 240e:3b1:5a22:5e70:5c05:54ff:fe6b:a599.19132: UDP, length 548
16:52:04.920922 IP 10.85.142.251.40333 > 10.127.255.255.19132: UDP, length 33
16:52:05.356465 IP6 240e:3b1:5a22:5e70:fbb2:6198:1d98:5ddb.37506 > 240e:3b1:5a22:5e70:5c05:54ff:fe6b:a599.19132: UDP, length 548
16:52:05.859362 IP6 240e:3b1:5a22:5e70:fbb2:6198:1d98:5ddb.37506 > 240e:3b1:5a22:5e70:5c05:54ff:fe6b:a599.19132: UDP, length 548
16:52:05.936986 IP 10.85.142.251.40333 > 10.127.255.255.19132: UDP, length 33
16:52:06.361585 IP6 240e:3b1:5a22:5e70:fbb2:6198:1d98:5ddb.37506 > 240e:3b1:5a22:5e70:5c05:54ff:fe6b:a599.19132: UDP, length 548
16:52:06.868082 IP6 240e:3b1:5a22:5e70:fbb2:6198:1d98:5ddb.37506 > 240e:3b1:5a22:5e70:5c05:54ff:fe6b:a599.19132: UDP, length 548
16:52:06.964555 IP 10.85.142.251.40333 > 10.127.255.255.19132: UDP, length 33
16:52:07.979004 IP 10.85.142.251.40333 > 10.127.255.255.19132: UDP, length 33
16:52:08.991130 IP 10.85.142.251.40333 > 10.127.255.255.19132: UDP, length 33
^C
38 packets captured
40 packets received by filter
0 packets dropped by kernel
```

以下是对 lo port 10484 的 udp 抓包, 空.
```text
root@server:~# tcpdump -n udp port 10484 -i lo
tcpdump: verbose output suppressed, use -v[v]... for full protocol decode
listening on lo, link-type EN10MB (Ethernet), snapshot length 262144 bytes
^C
0 packets captured
0 packets received by filter
0 packets dropped by kernel
```

端口的监听情况
```text
root@server:~# netstat -tuln | grep 19132
udp6       0      0 :::19132                :::*                               
root@server:~# netstat -tuln | grep 10484
udp        0      0 0.0.0.0:10484           0.0.0.0:*                          
udp6       0      0 :::10484                :::* 
```

MCBE 走的是 udp, docker compose 里面也仅打开了 19132:19132/udp, 不套 samwaf 时可连进服务器

**Comment by samwafgo** [comment]
1.logs/log.log下面有没有什么关联的日志？
2.这个MCBE 连接时用的ipv6？还是ipv4？

**Comment by minc-nice-100** [comment]
cat log.log | grep 19132

<img width="1024" height="700" alt="Image" src="https://github.com/user-attachments/assets/f203e40d-9560-4a45-8010-4ad13e9c1acf" />

我想下一个问题大抵不需要回答了

**Comment by samwafgo** [comment]
允许和禁止IP里面有填写ip吗？

**Comment by minc-nice-100** [comment]
> ### 产品版本
> 20250718(v1.3.16-beta.6)
> 
> ### 版本类型
> * [x]  社区版
> 
> ### 环境信息
> Ubuntu Server TLS 24 Docker Compose Network mode: host
> 
> ### 🐛 缺陷描述
> <img alt="Image" width="721" height="777" src="https://private-user-images.githubusercontent.com/100515973/470207199-dcb7883e-c788-4b01-9240-9b5c14907687.png?jwt=eyJhbGciOiJIUzI1NiIsInR5cCI6IkpXVCJ9.eyJpc3MiOiJnaXRodWIuY29tIiwiYXVkIjoicmF3LmdpdGh1YnVzZXJjb250ZW50LmNvbSIsImtleSI6ImtleTUiLCJleHAiOjE3NTM0MzQ0ODgsIm5iZiI6MTc1MzQzNDE4OCwicGF0aCI6Ii8xMDA1MTU5NzMvNDcwMjA3MTk5LWRjYjc4ODNlLWM3ODgtNGIwMS05MjQwLTliNWMxNDkwNzY4Ny5wbmc_WC1BbXotQWxnb3JpdGhtPUFXUzQtSE1BQy1TSEEyNTYmWC1BbXotQ3JlZGVudGlhbD1BS0lBVkNPRFlMU0E1M1BRSzRaQSUyRjIwMjUwNzI1JTJGdXMtZWFzdC0xJTJGczMlMkZhd3M0X3JlcXVlc3QmWC1BbXotRGF0ZT0yMDI1MDcyNVQwOTAzMDhaJlgtQW16LUV4cGlyZXM9MzAwJlgtQW16LVNpZ25hdHVyZT1kYmZhNmEzMTQ0YzgxNGRkNGJhNGExMDU0NWQ5ZWY3Y2Q2NmY3MzIxNmUwNWNiMWRiNDRjNzYzODc0ZDIzNWNhJlgtQW16LVNpZ25lZEhlYWRlcnM9aG9zdCJ9.G6SpLuvjR9vPUsaRtQLaKTHWhSIFi8xmGcf0rrO_aUA">
> 10484 是本地的 MC 服务器暴露的端口, 19132 是暴露给公网以及转发服务器的端口.
> 
> ### 期望结果
> 解决这个问题
> 
> ### 补充信息
> 以下是对 bond0 port 19132 的抓包, ipv6 的是我的连接流量
> 
> ```
> root@server:~# tcpdump -n udp port 19132 -i bond0
> tcpdump: verbose output suppressed, use -v[v]... for full protocol decode
> listening on bond0, link-type EN10MB (Ethernet), snapshot length 262144 bytes
> 16:51:39.787205 IP 10.85.142.251.40333 > 10.127.255.255.19132: UDP, length 33
> 16:51:40.807443 IP 10.85.142.251.40333 > 10.127.255.255.19132: UDP, length 33
> 16:51:41.801825 IP 10.85.142.251.40333 > 10.127.255.255.19132: UDP, length 33
> 16:51:42.840534 IP 10.85.142.251.40333 > 10.127.255.255.19132: UDP, length 33
> 16:51:45.671006 IP 10.85.142.251.40333 > 10.127.255.255.19132: UDP, length 33
> 16:51:46.689533 IP 10.85.142.251.40333 > 10.127.255.255.19132: UDP, length 33
> 16:51:47.705390 IP 10.85.142.251.40333 > 10.127.255.255.19132: UDP, length 33
> 16:51:48.713338 IP 10.85.142.251.40333 > 10.127.255.255.19132: UDP, length 33
> 16:51:49.302036 IP6 240e:3b1:5a22:5e70:fbb2:6198:1d98:5ddb.45434 > 240e:3b1:5a22:5e70:5c05:54ff:fe6b:a599.19132: UDP, length 33
> 16:51:49.730737 IP 10.85.142.251.40333 > 10.127.255.255.19132: UDP, length 33
> 16:51:50.745663 IP 10.85.142.251.40333 > 10.127.255.255.19132: UDP, length 33
> 16:51:51.761368 IP 10.85.142.251.40333 > 10.127.255.255.19132: UDP, length 33
> 16:51:52.785575 IP 10.85.142.251.40333 > 10.127.255.255.19132: UDP, length 33
> 16:51:53.800253 IP 10.85.142.251.40333 > 10.127.255.255.19132: UDP, length 33
> 16:51:54.795360 IP 10.85.142.251.40333 > 10.127.255.255.19132: UDP, length 33
> 16:51:55.821082 IP 10.85.142.251.40333 > 10.127.255.255.19132: UDP, length 33
> 16:51:56.826050 IP 10.85.142.251.40333 > 10.127.255.255.19132: UDP, length 33
> 16:51:57.850068 IP 10.85.142.251.40333 > 10.127.255.255.19132: UDP, length 33
> 16:51:58.856310 IP 10.85.142.251.40333 > 10.127.255.255.19132: UDP, length 33
> 16:51:59.873754 IP 10.85.142.251.40333 > 10.127.255.255.19132: UDP, length 33
> 16:52:00.874741 IP 10.85.142.251.40333 > 10.127.255.255.19132: UDP, length 33
> 16:52:01.892377 IP 10.85.142.251.40333 > 10.127.255.255.19132: UDP, length 33
> 16:52:02.830321 IP6 240e:3b1:5a22:5e70:fbb2:6198:1d98:5ddb.37506 > 240e:3b1:5a22:5e70:5c05:54ff:fe6b:a599.19132: UDP, length 1172
> 16:52:02.889126 IP 10.85.142.251.40333 > 10.127.255.255.19132: UDP, length 33
> 16:52:03.331905 IP6 240e:3b1:5a22:5e70:fbb2:6198:1d98:5ddb.37506 > 240e:3b1:5a22:5e70:5c05:54ff:fe6b:a599.19132: UDP, length 1172
> 16:52:03.852820 IP6 240e:3b1:5a22:5e70:fbb2:6198:1d98:5ddb.37506 > 240e:3b1:5a22:5e70:5c05:54ff:fe6b:a599.19132: UDP, length 1172
> 16:52:03.905506 IP 10.85.142.251.40333 > 10.127.255.255.19132: UDP, length 33
> 16:52:04.360692 IP6 240e:3b1:5a22:5e70:fbb2:6198:1d98:5ddb.37506 > 240e:3b1:5a22:5e70:5c05:54ff:fe6b:a599.19132: UDP, length 1172
> 16:52:04.850571 IP6 240e:3b1:5a22:5e70:fbb2:6198:1d98:5ddb.37506 > 240e:3b1:5a22:5e70:5c05:54ff:fe6b:a599.19132: UDP, length 548
> 16:52:04.920922 IP 10.85.142.251.40333 > 10.127.255.255.19132: UDP, length 33
> 16:52:05.356465 IP6 240e:3b1:5a22:5e70:fbb2:6198:1d98:5ddb.37506 > 240e:3b1:5a22:5e70:5c05:54ff:fe6b:a599.19132: UDP, length 548
> 16:52:05.859362 IP6 240e:3b1:5a22:5e70:fbb2:6198:1d98:5ddb.37506 > 240e:3b1:5a22:5e70:5c05:54ff:fe6b:a599.19132: UDP, length 548
> 16:52:05.936986 IP 10.85.142.251.40333 > 10.127.255.255.19132: UDP, length 33
> 16:52:06.361585 IP6 240e:3b1:5a22:5e70:fbb2:6198:1d98:5ddb.37506 > 240e:3b1:5a22:5e70:5c05:54ff:fe6b:a599.19132: UDP, length 548
> 16:52:06.868082 IP6 240e:3b1:5a22:5e70:fbb2:6198:1d98:5ddb.37506 > 240e:3b1:5a22:5e70:5c05:54ff:fe6b:a599.19132: UDP, length 548
> 16:52:06.964555 IP 10.85.142.251.40333 > 10.127.255.255.19132: UDP, length 33
> 16:52:07.979004 IP 10.85.142.251.40333 > 10.127.255.255.19132: UDP, length 33
> 16:52:08.991130 IP 10.85.142.251.40333 > 10.127.255.255.19132: UDP, length 33
> ^C
> 38 packets captured
> 40 packets received by filter
> 0 packets dropped by kernel
> ```
> 
> 以下是对 lo port 10484 的 udp 抓包, 空.
> 
> ```
> root@server:~# tcpdump -n udp port 10484 -i lo
> tcpdump: verbose output suppressed, use -v[v]... for full protocol decode
> listening on lo, link-type EN10MB (Ethernet), snapshot length 262144 bytes
> ^C
> 0 packets captured
> 0 packets received by filter
> 0 packets dropped by kernel
> ```
> 
> 端口的监听情况
> 
> ```
> root@server:~# netstat -tuln | grep 19132
> udp6       0      0 :::19132                :::*                               
> root@server:~# netstat -tuln | grep 10484
> udp        0      0 0.0.0.0:10484           0.0.0.0:*                          
> udp6       0      0 :::10484                :::* 
> ```
> 
> MCBE 走的是 udp, docker compose 里面也仅打开了 19132:19132/udp, 不套 samwaf 时可连进服务器

参见缺陷描述那张大图

**Comment by minc-nice-100** [comment]
> 允许和禁止IP里面有填写ip吗？

没有
